3-way handshake
    1 0.000000000    127.0.0.1 ? 127.0.0.1    TCP 74 54134 ? 8080 [SYN] Seq=0 Win=65495 Len=0 MSS=65495 SACK_PERM TSval=3817603282 TSecr=0 WS=128
    2 0.000012500    127.0.0.1 ? 127.0.0.1    TCP 74 8080 ? 54134 [SYN, ACK] Seq=0 Ack=1 Win=65483 Len=0 MSS=65495 SACK_PERM TSval=3817603282 TSecr=3817603282 WS=128
    3 0.000020167    127.0.0.1 ? 127.0.0.1    TCP 66 54134 ? 8080 [ACK] Seq=1 Ack=1 Win=65536 Len=0 TSval=3817603282 TSecr=3817603282


clt.shutdown(BOTH) -> FIN
    4 0.000042875    127.0.0.1 ? 127.0.0.1    TCP 66 54134 ? 8080 [FIN, ACK] Seq=1 Ack=1 Win=65536 Len=0 TSval=3817603282 TSecr=3817603282
svc write
    5 0.000061167    127.0.0.1 ? 127.0.0.1    TCP 76 8080 ? 54134 [PSH, ACK] Seq=1 Ack=2 Win=65536 Len=10 TSval=3817603282 TSecr=3817603282
kernel indicates noone is listening ->RST
    6 0.000066334    127.0.0.1 ? 127.0.0.1    TCP 54 54134 ? 8080 [RST] Seq=2 Win=0 Len=0
